{
  "killteamId": "IMP-PHO",
  "locale": "es",
  "equipments": {
    "IMP-PHO-PS": {
      "effects": ""
    },
    "IMP-PHO-AUG": {
      "effects": ""
    },
    "IMP-PHO-CB": {
      "effects": "ADDWEP:Combat Blade|M|5|3+|3/4|"
    },
    "IMP-PHO-SIA": {
      "effects": ""
    }
  },
  "opTypes": {
    "IMP-PHO-INFSAB": {
      "abilities": {
        "IMP-PHO-INFSAB-A-DET": {
          "description": "Don't select a valid target. Instead, shoot against each operative within 2\" of your Explosives marker, unless Heavy terrain is wholly intervening between that operative and that marker.\nEach of those operatives cannot be in cover or obscured.\nRoll each sequence separately in an order of your choice.\nThis weapon cannot be selected if your Explosives marker is not in the killzone.\nAt the end of the action, remove your Explosives marker from the killzone.\nIn a killzone that uses the close quarters rules (e.g. Killzone: Tomb World), this weapon has the Lethal 5+ weapon rule."
        }
      }
    }
  }
}
